<?xml version="1.0" encoding="UTF-8"?>
<list xmlns:xsi="http://www.w3.org/2001/XMLSchema-instance" xsi:noNamespaceSchemaLocation="../../xsd/transformations.xsd">
	<transform id="164" type="RIDING_MODE" can_swim="0" normal_attackable="0">
		<Male>
			<common>
				<base range="20" attackSpeed="300" attackType="SWORD" critRate="5" mAtk="5" pAtk="5" randomDamage="10" />
				<collision radius="21.5" height="19.7" />
				<moving walk="45" run="170" waterWalk="50" waterRun="50" flyWalk="0" flyRun="0" unknownWalk="0" unknownRun="0" />
			</common>
			<actions>1 3 4 5 6 7 8 9 11 15 16 17 18 19 21 22 23 32 36 39 40 41 42 43 44 45 46 47 48 50 52 53 54 55 56 57 63 64 65 70 86 1000 1001 1003 1004 1005 1006 1007 1008 1009 1010 1011 1012 1013 1014 1015 1016 1017 1018 1019 1020 1021 1022 1023 1024 1025 1026 1027 1028 1029 1030 1031 1032 1033 1034 1035 1036 1037 1038 1039 1040 1041 1042 1043 1044 1045 1046 1047 1048 1049 1050 1051 1052 1053 1054 1055 1056 1057 1058 1059 1060 1061 1062 1063 1064 1065 1066 1067 1068 1069 1070 1071 1072 1073 1074 1075 1076 1077 1078 1079 1080 1081 1082 1083 1084 1089 1090 1091 1092 1093 1094 1095 1096 1097 1098 1099 1100 1101 1102 1103 1104 1106 1107 1108 1109 1110 1111 1113 1114 1115 1116 1117 1118 1120 1121</actions>
			<skills>
				<skill id="9210" level="1" /> <!-- Dismount -->
				<skill id="5437" level="2" /> <!-- Dissonance -->
				<skill id="9206" level="1" /> <!-- Fast Run -->
			</skills>
		</Male>
		<Female>
			<common>
				<base range="20" attackSpeed="300" attackType="SWORD" critRate="5" mAtk="5" pAtk="5" randomDamage="10" />
				<collision radius="21.5" height="19.7" />
				<moving walk="45" run="170" waterWalk="50" waterRun="50" flyWalk="0" flyRun="0" unknownWalk="0" unknownRun="0" />
			</common>
			<actions>1 3 4 5 6 7 8 9 11 15 16 17 18 19 21 22 23 32 36 39 40 41 42 43 44 45 46 47 48 50 52 53 54 55 56 57 63 64 65 70 86 1000 1001 1003 1004 1005 1006 1007 1008 1009 1010 1011 1012 1013 1014 1015 1016 1017 1018 1019 1020 1021 1022 1023 1024 1025 1026 1027 1028 1029 1030 1031 1032 1033 1034 1035 1036 1037 1038 1039 1040 1041 1042 1043 1044 1045 1046 1047 1048 1049 1050 1051 1052 1053 1054 1055 1056 1057 1058 1059 1060 1061 1062 1063 1064 1065 1066 1067 1068 1069 1070 1071 1072 1073 1074 1075 1076 1077 1078 1079 1080 1081 1082 1083 1084 1089 1090 1091 1092 1093 1094 1095 1096 1097 1098 1099 1100 1101 1102 1103 1104 1106 1107 1108 1109 1110 1111 1113 1114 1115 1116 1117 1118 1120 1121</actions>
			<skills>
				<skill id="9210" level="1" /> <!-- Dismount -->
				<skill id="5437" level="2" /> <!-- Dissonance -->
				<skill id="9206" level="1" /> <!-- Fast Run -->
			</skills>
		</Female>
	</transform>
</list>